moneda,zona_url,ciudad,actividad,precio,opiniones,fuente,fecha_scan
CLP,https://www.civitatis.com/es/llanos-orientales/,Villavicencio,Avistamiento de aves en Villavicencio,"135.477,70 CL$",Sin valorar,Civitatis,2025-12-30 19:22
CLP,https://www.civitatis.com/es/llanos-orientales/,Villavicencio,Excursión a las Cortinas del Diamante,"132.186,74 CL$",Sin valorar,Civitatis,2025-12-30 19:22
CLP,https://www.civitatis.com/es/llanos-orientales/,Villavicencio,Excursión al Charco Azul,"165.900,76 CL$",Sin valorar,Civitatis,2025-12-30 19:22
CLP,https://www.civitatis.com/es/llanos-orientales/,Villavicencio,"Excursión a las cascadas Caracas, Pelton y Santuario","132.186,74 CL$",Sin valorar,Civitatis,2025-12-30 19:22
CLP,https://www.civitatis.com/es/llanos-orientales/,La Macarena,"Tour de 3, 4 o 5 días por Caño Cristales y Sierra de La Macarena","420.772,27 CL$",2 opiniones,Civitatis,2025-12-30 19:22
CLP,https://www.civitatis.com/es/magdalena/,"Santa Marta, Colombia",Excursión a Minca,"63.207,25 CL$",186 opiniones,Civitatis,2025-12-30 19:22
CLP,https://www.civitatis.com/es/magdalena/,"Santa Marta, Colombia",Excursión al Parque Tayrona,"57.461,14 CL$",330 opiniones,Civitatis,2025-12-30 19:22
CLP,https://www.civitatis.com/es/magdalena/,"Santa Marta, Colombia",Free tour por Santa Marta,¡Gratis!,1.534 opiniones,Civitatis,2025-12-30 19:22
CLP,https://www.civitatis.com/es/magdalena/,Varios destinos,Safari por el río Don Diego,"80.967,97 CL$",Sin valorar,Civitatis,2025-12-30 19:22
CLP,https://www.civitatis.com/es/magdalena/,"Santa Marta, Colombia",Tour en bicicleta por Santa Marta,"16.977,15 CL$",Sin valorar,Civitatis,2025-12-30 19:22
CLP,https://www.civitatis.com/es/magdalena/,,Traslados en Magdalena,"4.310,89 CL$",227 opiniones,Civitatis,2025-12-30 19:22
CLP,https://www.civitatis.com/es/magdalena/,"Santa Marta, Colombia",Excursión a las playas Cinto y Cristal,"79.662,03 CL$",29 opiniones,Civitatis,2025-12-30 19:22
CLP,https://www.civitatis.com/es/magdalena/,"Santa Marta, Colombia",Tour en chiva rumbera por Santa Marta,"14.365,28 CL$",Sin valorar,Civitatis,2025-12-30 19:22
CLP,https://www.civitatis.com/es/magdalena/,"Santa Marta, Colombia",Free tour de los misterios y leyendas de Santa Marta,¡Gratis!,7 opiniones,Civitatis,2025-12-30 19:22
CLP,https://www.civitatis.com/es/magdalena/,"Santa Marta, Colombia",Senderismo por la Selva de Minca + Visita a una finca de café,"75.744,23 CL$",48 opiniones,Civitatis,2025-12-30 19:22
CLP,https://www.civitatis.com/es/magdalena/,"Santa Marta, Colombia",Tour de 4 o 5 días por el Caribe colombiano,"483.195,97 CL$",Sin valorar,Civitatis,2025-12-30 19:22
CLP,https://www.civitatis.com/es/magdalena/,"Santa Marta, Colombia",Excursión a Playa Cristal,"56.155,20 CL$",136 opiniones,Civitatis,2025-12-30 19:22
CLP,https://www.civitatis.com/es/magdalena/,"Santa Marta, Colombia",Excursión a Playa Blanca y Mundo Marino,"75.744,23 CL$",35 opiniones,Civitatis,2025-12-30 19:22
CLP,https://www.civitatis.com/es/magdalena/,"Santa Marta, Colombia","Excursión a Playa Grande, Pozo Azul de Minca y Taganga","39.178,05 CL$",21 opiniones,Civitatis,2025-12-30 19:22
CLP,https://www.civitatis.com/es/magdalena/,"Santa Marta, Colombia",Excursión a Cartagena,"151.018,33 CL$",4 opiniones,Civitatis,2025-12-30 19:22
CLP,https://www.civitatis.com/es/magdalena/,"Santa Marta, Colombia",Paseo en velero por la bahía de Taganga,"39.178,05 CL$",8 opiniones,Civitatis,2025-12-30 19:22
CLP,https://www.civitatis.com/es/magdalena/,"Santa Marta, Colombia",Seawalker en Santa Marta,"41.789,92 CL$",13 opiniones,Civitatis,2025-12-30 19:22
CLP,https://www.civitatis.com/es/magdalena/,"Santa Marta, Colombia",Excursión a Taganga y Playa Grande,"33.954,31 CL$",30 opiniones,Civitatis,2025-12-30 19:22
CLP,https://www.civitatis.com/es/magdalena/,"Santa Marta, Colombia",Trekking de 4 o 5 días por la Ciudad Perdida,"485.807,84 CL$",33 opiniones,Civitatis,2025-12-30 19:22
CLP,https://www.civitatis.com/es/magdalena/,Minca,Free tour por Minca,¡Gratis!,Sin valorar,Civitatis,2025-12-30 19:22
CLP,https://www.civitatis.com/es/magdalena/,Santa Marta,Paseo en velero por Bahía Concha,"61.640,13 CL$",65 opiniones,Civitatis,2025-12-30 19:22
CLP,https://www.civitatis.com/es/magdalena/,Santa Marta,Tour de Santa Marta al completo,"78.356,10 CL$",20 opiniones,Civitatis,2025-12-30 19:22
CLP,https://www.civitatis.com/es/magdalena/,Santa Marta,Tour panorámico por Santa Marta,"52.237,40 CL$",18 opiniones,Civitatis,2025-12-30 19:22
CLP,https://www.civitatis.com/es/magdalena/,Santa Marta,Excursión a Taironaka,"76.279,66 CL$",11 opiniones,Civitatis,2025-12-30 19:22
CLP,https://www.civitatis.com/es/magdalena/,Santa Marta,Excursión a Bahía Concha,"42.312,29 CL$",5 opiniones,Civitatis,2025-12-30 19:22
CLP,https://www.civitatis.com/es/magdalena/,Santa Marta,Tour de Macondo por Aracataca,"106.028,86 CL$",10 opiniones,Civitatis,2025-12-30 19:22
CLP,https://www.civitatis.com/es/magdalena/,Santa Marta,Excursión a Barranquilla,"88.607,69 CL$",Sin valorar,Civitatis,2025-12-30 19:22
CLP,https://www.civitatis.com/es/magdalena/,Santa Marta,Excursión a Palomino,"95.349,71 CL$",Sin valorar,Civitatis,2025-12-30 19:22
CLP,https://www.civitatis.com/es/magdalena/,Santa Marta,Tour de los misterios y leyendas de Santa Marta,"39.178,05 CL$",3 opiniones,Civitatis,2025-12-30 19:22
CLP,https://www.civitatis.com/es/magdalena/,Santa Marta,Excursión a las cascadas de Marinka + Sierra Minca,"91.415,45 CL$",6 opiniones,Civitatis,2025-12-30 19:22
CLP,https://www.civitatis.com/es/magdalena/,Santa Marta,Excursión a Ciénaga,"64.722,14 CL$",3 opiniones,Civitatis,2025-12-30 19:22
CLP,https://www.civitatis.com/es/magdalena/,Santa Marta,Excursión a las Islas del Rosario,"190.699,16 CL$",Sin valorar,Civitatis,2025-12-30 19:22
CLP,https://www.civitatis.com/es/magdalena/,Santa Marta,Tour privado por Santa Marta,"89.064,77 CL$",1 opinión,Civitatis,2025-12-30 19:22
CLP,https://www.civitatis.com/es/magdalena/,Santa Marta,Tubing en el río Palomino,"64.970,26 CL$",4 opiniones,Civitatis,2025-12-30 19:22
CLP,https://www.civitatis.com/es/magdalena/,Santa Marta,Excursión a los pueblos palafitos de Ciénaga,106.283 CL$,3 opiniones,Civitatis,2025-12-30 19:22
CLP,https://www.civitatis.com/es/magdalena/,Santa Marta,Snorkel en el Parque Tayrona,"65.296,75 CL$",6 opiniones,Civitatis,2025-12-30 19:22
CLP,https://www.civitatis.com/es/magdalena/,Santa Marta,Excursión privada por las playas de Santa Marta en lancha pontón,"626.848,83 CL$",1 opinión,Civitatis,2025-12-30 19:22
CLP,https://www.civitatis.com/es/magdalena/,Santa Marta,Bautismo de buceo en Taganga,"107.086,67 CL$",1 opinión,Civitatis,2025-12-30 19:22
CLP,https://www.civitatis.com/es/magdalena/,Santa Marta,Excursión a una comunidad indígena Kogui,"148.876,59 CL$",2 opiniones,Civitatis,2025-12-30 19:22
CLP,https://www.civitatis.com/es/magdalena/,Santa Marta,Rápel en las cascadas del río Minca,"73.132,36 CL$",1 opinión,Civitatis,2025-12-30 19:23
CLP,https://www.civitatis.com/es/magdalena/,Santa Marta,Excursión a Playa Inca Inca,"65.819,12 CL$",Sin valorar,Civitatis,2025-12-30 19:23
CLP,https://www.civitatis.com/es/magdalena/,Santa Marta,Tour del café por la región de Santa Marta,"118.317,71 CL$",Sin valorar,Civitatis,2025-12-30 19:23
CLP,https://www.civitatis.com/es/magdalena/,Santa Marta,Excursión a Buritaca y la Quebrada Valencia,"25.888,85 CL$",5 opiniones,Civitatis,2025-12-30 19:23
CLP,https://www.civitatis.com/es/magdalena/,Santa Marta,Tubing en el río Buritaca,"65.296,75 CL$",Sin valorar,Civitatis,2025-12-30 19:23
CLP,https://www.civitatis.com/es/magdalena/,Santa Marta,Curso de surf en Palomino,"86.191,71 CL$",Sin valorar,Civitatis,2025-12-30 19:23
CLP,https://www.civitatis.com/es/magdalena/,Santa Marta,Excursión de 2 días al Cabo de la Vela,"130.593,50 CL$",8 opiniones,Civitatis,2025-12-30 19:23
CLP,https://www.civitatis.com/es/magdalena/,Santa Marta,Avistamiento de aves en Minca,"70.520,49 CL$",Sin valorar,Civitatis,2025-12-30 19:23
CLP,https://www.civitatis.com/es/magdalena/,Santa Marta,Excursión a la Ciénaga Grande de Santa Marta,"116.499,85 CL$",Sin valorar,Civitatis,2025-12-30 19:23
CLP,https://www.civitatis.com/es/magdalena/,Minca,Trekking por la Sierra Nevada de Santa Marta,"41.789,92 CL$",Sin valorar,Civitatis,2025-12-30 19:23
CLP,https://www.civitatis.com/es/magdalena/,Santa Marta,Tour en buggy por Bonda,"137.645,55 CL$",1 opinión,Civitatis,2025-12-30 19:23
CLP,https://www.civitatis.com/es/magdalena/,Minca,Taller de cacao en Casa Jocolate Minca,"5.746,11 CL$",1 opinión,Civitatis,2025-12-30 19:23
CLP,https://www.civitatis.com/es/magdalena/,Santa Marta,Excursión al refugio indígena Gotsezhy,"172.383,42 CL$",1 opinión,Civitatis,2025-12-30 19:23
CLP,https://www.civitatis.com/es/magdalena/,Santa Marta,Senderismo hasta la cascada El Saltillo + Visita a una finca de maracuyá,"88.803,58 CL$",Sin valorar,Civitatis,2025-12-30 19:23
CLP,https://www.civitatis.com/es/magdalena/,Varios destinos,Senderismo por las cascadas de Minca,"106.303,11 CL$",1 opinión,Civitatis,2025-12-30 19:23
CLP,https://www.civitatis.com/es/magdalena/,Santa Marta,Tour por las iglesias de Santa Marta,"31.342,44 CL$",Sin valorar,Civitatis,2025-12-30 19:23
CLP,https://www.civitatis.com/es/magdalena/,Santa Marta,Excursión a la Laguna Encantada,"57.461,14 CL$",Sin valorar,Civitatis,2025-12-30 19:23
CLP,https://www.civitatis.com/es/magdalena/,Santa Marta,Tour del grafiti por Santa Marta + Taller de cócteles,"62.684,88 CL$",Sin valorar,Civitatis,2025-12-30 19:23
CLP,https://www.civitatis.com/es/magdalena/,Varios destinos,Excursión a las playas Los Cocos y Los Naranjos + Paseo a caballo,"133.205,37 CL$",Sin valorar,Civitatis,2025-12-30 19:23
CLP,https://www.civitatis.com/es/magdalena/,Ciénaga,Excursión a Aracataca,"96.312,71 CL$",Sin valorar,Civitatis,2025-12-30 19:23
CLP,https://www.civitatis.com/es/magdalena/,Ciénaga,Paseo en barco por la Vía Parque Isla de Salamanca,"124.063,83 CL$",Sin valorar,Civitatis,2025-12-30 19:23
CLP,https://www.civitatis.com/es/magdalena/,Ciénaga,Tour por la Ciénaga Grande de Santa Marta,"77.812,05 CL$",Sin valorar,Civitatis,2025-12-30 19:23
CLP,https://www.civitatis.com/es/magdalena/,Ciénaga,Excursión a las termas El Volcán,"39.178,05 CL$",1 opinión,Civitatis,2025-12-30 19:23
CLP,https://www.civitatis.com/es/magdalena/,Santa Marta,"Tour de 4 días por Santa Marta, Cabo de la Vela y Riohacha","389.168,64 CL$",1 opinión,Civitatis,2025-12-30 19:23
CLP,https://www.civitatis.com/es/magdalena/,Santa Marta,Tour de Gabriel García Márquez y el Caribe colombiano en 8 días,"1.251.085,79 CL$",Sin valorar,Civitatis,2025-12-30 19:23
CLP,https://www.civitatis.com/es/magdalena/,Ciénaga,Tour por Ciénaga,"48.972,56 CL$",Sin valorar,Civitatis,2025-12-30 19:23
CLP,https://www.civitatis.com/es/magdalena/,Santa Marta,Excursión en lancha a las playas del Parque Tayrona en grupo reducido,"81.490,34 CL$",Sin valorar,Civitatis,2025-12-30 19:23
CLP,https://www.civitatis.com/es/magdalena/,Ciénaga,Avistamiento de aves en la Ciénaga Grande de Santa Marta,"76.179,63 CL$",Sin valorar,Civitatis,2025-12-30 19:23
CLP,https://www.civitatis.com/es/magdalena/,Minca,Avistamiento de aves en Minca,"31.603,62 CL$",Sin valorar,Civitatis,2025-12-30 19:23
CLP,https://www.civitatis.com/es/magdalena/,Santa Marta,Excursión al refugio indígena Katanzama + Tubing en el río Don Diego,"143.652,85 CL$",Sin valorar,Civitatis,2025-12-30 19:23
CLP,https://www.civitatis.com/es/magdalena/,Santa Marta,Excursión privada desde Santa Marta,"198.502,13 CL$",Sin valorar,Civitatis,2025-12-30 19:23
CLP,https://www.civitatis.com/es/magdalena/,Ciénaga,Senderismo por la Vía Parque Isla de Salamanca,"109.372,06 CL$",Sin valorar,Civitatis,2025-12-30 19:23
CLP,https://www.civitatis.com/es/magdalena/,Santa Marta,Curso de buceo PADI Open Water,"391.780,51 CL$",Sin valorar,Civitatis,2025-12-30 19:23
CLP,https://www.civitatis.com/es/magdalena/,Varios destinos,Senderismo por el río Don Diego con avistamiento de aves,"84.885,77 CL$",Sin valorar,Civitatis,2025-12-30 19:23
CLP,https://www.civitatis.com/es/magdalena/,Santa Marta,Excursión al Cerro Kennedy al amanecer + Pozo Azul,"247.082,91 CL$",Sin valorar,Civitatis,2025-12-30 19:23
CLP,https://www.civitatis.com/es/magdalena/,Santa Marta,Excursión de 2 días a Cartagena,"250.739,53 CL$",Sin valorar,Civitatis,2025-12-30 19:23
CLP,https://www.civitatis.com/es/magdalena/,Santa Marta,Visita a una finca cafetera + Cata de cervezas artesanales,"65.296,75 CL$",3 opiniones,Civitatis,2025-12-30 19:23
CLP,https://www.civitatis.com/es/magdalena/,Santa Marta,Cata de café en Santa Marta,"14.104,09 CL$",Sin valorar,Civitatis,2025-12-30 19:23
CLP,https://www.civitatis.com/es/magdalena/,Santa Marta,Excursión al laberinto Macondo + Tubing en el río Don Diego,"111.004,48 CL$",Sin valorar,Civitatis,2025-12-30 19:23
CLP,https://www.civitatis.com/es/narino/,Pasto,Excursión al Santuario de Las Lajas y cementerio de Tulcán,"118.840,09 CL$",25 opiniones,Civitatis,2025-12-30 19:23
CLP,https://www.civitatis.com/es/narino/,Pasto,Excursión a la laguna de La Cocha,"91.415,45 CL$",9 opiniones,Civitatis,2025-12-30 19:23
CLP,https://www.civitatis.com/es/narino/,Ipiales,Excursión al santuario de Las Lajas y Tulcán,"95.072,07 CL$",7 opiniones,Civitatis,2025-12-30 19:23
CLP,https://www.civitatis.com/es/narino/,Pasto,Excursión al volcán Galeras y sus pueblos,"115.450,40 CL$",3 opiniones,Civitatis,2025-12-30 19:23
CLP,https://www.civitatis.com/es/narino/,Ipiales,Excursión a la laguna de la Cocha e isla La Corota,"91.415,45 CL$",1 opinión,Civitatis,2025-12-30 19:23
CLP,https://www.civitatis.com/es/narino/,Pasto,Tour por Pasto,"69.965,47 CL$",1 opinión,Civitatis,2025-12-30 19:23
CLP,https://www.civitatis.com/es/narino/,Ipiales,Excursión a Pasto,"118.840,09 CL$",Sin valorar,Civitatis,2025-12-30 19:23
CLP,https://www.civitatis.com/es/narino/,Pasto,Excursión privada desde Pasto,"356.520,27 CL$",2 opiniones,Civitatis,2025-12-30 19:23
CLP,https://www.civitatis.com/es/narino/,Pasto,Excursión a la laguna de La Cocha y humedales de Santa Lucía,"157.895,38 CL$",Sin valorar,Civitatis,2025-12-30 19:23
CLP,https://www.civitatis.com/es/narino/,Pasto,Laguna de La Cocha y humedales de Santa Lucía + Pesca en el río Guamúez,"94.386,45 CL$",Sin valorar,Civitatis,2025-12-30 19:23
CLP,https://www.civitatis.com/es/narino/,Pasto,Visita a una comunidad inga en Sibundoy,"118.840,09 CL$",Sin valorar,Civitatis,2025-12-30 19:23
CLP,https://www.civitatis.com/es/narino/,Pasto,Senderismo por Guachucal y la laguna de La Bolsa,"118.840,09 CL$",Sin valorar,Civitatis,2025-12-30 19:23
CLP,https://www.civitatis.com/es/narino/,Pasto,Tour privado por Pasto,"209.896,41 CL$",1 opinión,Civitatis,2025-12-30 19:23
CLP,https://www.civitatis.com/es/narino/,Ipiales,Trekking nocturno por el volcán Cumbal,"57.461,14 CL$",1 opinión,Civitatis,2025-12-30 19:23
CLP,https://www.civitatis.com/es/region-andina/,Bogotá,Excursión a la Catedral de Sal de Zipaquirá,"46.752,47 CL$",913 opiniones,Civitatis,2025-12-30 19:24
CLP,https://www.civitatis.com/es/region-andina/,Bogotá,Oferta: Guatavita + Catedral de Sal de Zipaquirá,"72.871,17 CL$",765 opiniones,Civitatis,2025-12-30 19:24
CLP,https://www.civitatis.com/es/region-andina/,Bogotá,Free tour por Bogotá,¡Gratis!,3.750 opiniones,Civitatis,2025-12-30 19:24
CLP,https://www.civitatis.com/es/region-andina/,Bogotá,Excursión a la Catedral de Sal de Zipaquirá + Andrés Carne de Res en Chía,"67.908,62 CL$",119 opiniones,Civitatis,2025-12-30 19:24
CLP,https://www.civitatis.com/es/region-andina/,Bogotá,Visita guiada por Bogotá + Teleférico a Montserrate,"78.356,10 CL$",272 opiniones,Civitatis,2025-12-30 19:24
CLP,https://www.civitatis.com/es/region-andina/,Bogotá,Excursión a Villa de Leyva,"114.922,28 CL$",65 opiniones,Civitatis,2025-12-30 19:24
CLP,https://www.civitatis.com/es/region-andina/,Bogotá,Tour de la cultura colombiana,"32.648,37 CL$",146 opiniones,Civitatis,2025-12-30 19:24
CLP,https://www.civitatis.com/es/region-andina/,Bogotá,Tour de Bogotá al completo con entradas,"121.451,96 CL$",142 opiniones,Civitatis,2025-12-30 19:24
CLP,https://www.civitatis.com/es/region-andina/,Bogotá,Trekking por el Parque Aventura La Chorrera,"108.392,61 CL$",49 opiniones,Civitatis,2025-12-30 19:24
CLP,https://www.civitatis.com/es/region-andina/,Bogotá,Visita guiada por el Museo del Oro y el barrio de La Candelaria,"37.963,53 CL$",27 opiniones,Civitatis,2025-12-30 19:24
CLP,https://www.civitatis.com/es/region-andina/,Bogotá,Tour privado por Bogotá,"91.415,45 CL$",81 opiniones,Civitatis,2025-12-30 19:24
CLP,https://www.civitatis.com/es/region-andina/,Bogotá,Free tour por el cerro de Monserrate,¡Gratis!,629 opiniones,Civitatis,2025-12-30 19:24
CLP,https://www.civitatis.com/es/region-andina/,Bogotá,Free tour por el barrio de La Candelaria,¡Gratis!,92 opiniones,Civitatis,2025-12-30 19:24
CLP,https://www.civitatis.com/es/region-andina/,Bogotá,Excursión a Zipaquirá en el Tren Turístico de la Sabana,"98.728,69 CL$",12 opiniones,Civitatis,2025-12-30 19:24
CLP,https://www.civitatis.com/es/region-andina/,Bogotá,Visita guiada por Monserrate,"26.118,70 CL$",22 opiniones,Civitatis,2025-12-30 19:24
CLP,https://www.civitatis.com/es/region-andina/,Bogotá,"Tour por los barrios de San Diego, La Merced y La Macarena","24.917,24 CL$",2 opiniones,Civitatis,2025-12-30 19:24
CLP,https://www.civitatis.com/es/region-andina/,Bogotá,Free tour del grafiti por Bogotá,¡Gratis!,876 opiniones,Civitatis,2025-12-30 19:24
CLP,https://www.civitatis.com/es/region-andina/,Bogotá,Free tour gastronómico por Bogotá,¡Gratis!,87 opiniones,Civitatis,2025-12-30 19:24
CLP,https://www.civitatis.com/es/region-andina/,Bogotá,Free tour en bicicleta por el centro de Bogotá,¡Gratis!,480 opiniones,Civitatis,2025-12-30 19:24
CLP,https://www.civitatis.com/es/region-andina/,Bogotá,Free tour por el barrio de Chapinero,¡Gratis!,7 opiniones,Civitatis,2025-12-30 19:24
CLP,https://www.civitatis.com/es/region-andina/,Bucaramanga,Excursión al Parque Nacional del Chicamocha,"73.132,36 CL$",5 opiniones,Civitatis,2025-12-30 19:24
CLP,https://www.civitatis.com/es/region-andina/,Honda,Tour privado por Honda,"39.178,05 CL$",4 opiniones,Civitatis,2025-12-30 19:24
CLP,https://www.civitatis.com/es/region-andina/,Bucaramanga,Free tour por Bucaramanga,¡Gratis!,4 opiniones,Civitatis,2025-12-30 19:24
CLP,https://www.civitatis.com/es/region-andina/,Bucaramanga,"Excursión a Barichara, Curití y San Gil","53.282,15 CL$",1 opinión,Civitatis,2025-12-30 19:24
CLP,https://www.civitatis.com/es/region-andina/,Barichara,Free tour por Barichara,¡Gratis!,13 opiniones,Civitatis,2025-12-30 19:24
CLP,https://www.civitatis.com/es/region-andina/,Bucaramanga,Free tour por Girón,¡Gratis!,Novedad,Civitatis,2025-12-30 19:24
CLP,https://www.civitatis.com/es/region-andina/,Bucaramanga,Free tour por el mercado de Bucaramanga,¡Gratis!,Novedad,Civitatis,2025-12-30 19:24
CLP,https://www.civitatis.com/es/region-andina/,Bucaramanga,Free tour por Piedecuesta,¡Gratis!,Novedad,Civitatis,2025-12-30 19:24
CLP,https://www.civitatis.com/es/region-andina/,Bucaramanga,Free tour por la Comuna 12,¡Gratis!,Novedad,Civitatis,2025-12-30 19:24
CLP,https://www.civitatis.com/es/region-andina/,Barichara,Visita guiada por Barichara,"15.671,22 CL$",6 opiniones,Civitatis,2025-12-30 19:24
CLP,https://www.civitatis.com/es/region-andina/,Barichara,Senderismo por el Camino Real hasta Guane,"20.894,96 CL$",4 opiniones,Civitatis,2025-12-30 19:24
CLP,https://www.civitatis.com/es/region-andina/,San Gil,Excursión a la Cueva del Indio,"20.894,96 CL$",3 opiniones,Civitatis,2025-12-30 19:24
CLP,https://www.civitatis.com/es/region-andina/,San Gil,Rafting en el río Fonce,"15.671,22 CL$",4 opiniones,Civitatis,2025-12-30 19:24
CLP,https://www.civitatis.com/es/region-andina/,Bucaramanga,Tour por Bucaramanga y Girón + Visita al Cerro del Santísimo,"41.267,54 CL$",2 opiniones,Civitatis,2025-12-30 19:24
CLP,https://www.civitatis.com/es/region-andina/,San Gil,Tour de aventura en Pinchote,"31.342,44 CL$",Sin valorar,Civitatis,2025-12-30 19:24
CLP,https://www.civitatis.com/es/region-andina/,Barichara,Tour por los escenarios de Encanto en Barichara,"95.333,25 CL$",Sin valorar,Civitatis,2025-12-30 19:24
CLP,https://www.civitatis.com/es/region-andina/,San Gil,Tour de aventura en San Gil,"33.954,31 CL$",Sin valorar,Civitatis,2025-12-30 19:25
CLP,https://www.civitatis.com/es/region-andina/,Barichara,Excursión al Parque Ecológico Cascadas de Juan Curi,"58.767,07 CL$",Sin valorar,Civitatis,2025-12-30 19:25
CLP,https://www.civitatis.com/es/region-andina/,Honda,Tour privado por la Ruta el Saltarín con avistamiento de aves,"73.132,36 CL$",Sin valorar,Civitatis,2025-12-30 19:25
CLP,https://www.civitatis.com/es/region-andina/,Varios destinos,Excursión privada por Santander,"139.996,23 CL$",Sin valorar,Civitatis,2025-12-30 19:25
CLP,https://www.civitatis.com/es/region-andina/,Barichara,Senderismo por el Camino Real hasta el cañón del Río Suárez,"44.924,16 CL$",Sin valorar,Civitatis,2025-12-30 19:25
CLP,https://www.civitatis.com/es/region-andina/,San Gil,Vuelo en parapente por el Cañón del Chicamocha,"65.296,75 CL$",Sin valorar,Civitatis,2025-12-30 19:25
CLP,https://www.civitatis.com/es/region-andina/,Bucaramanga,Excursión al embalse Topocoro,"49.625,53 CL$",Sin valorar,Civitatis,2025-12-30 19:25
CLP,https://www.civitatis.com/es/region-andina/,Bucaramanga,Excursión a Zapatoca,"56.416,39 CL$",Sin valorar,Civitatis,2025-12-30 19:25
CLP,https://www.civitatis.com/es/region-andina/,Murillo,Ruta privada de senderismo por el Valle de los Frailejones,"182.830,90 CL$",Sin valorar,Civitatis,2025-12-30 19:25
CLP,https://www.civitatis.com/es/region-andina/,Murillo,Ruta privada de senderismo por El Bosque + Termales de Canaán,"231.803,47 CL$",Sin valorar,Civitatis,2025-12-30 19:26
CLP,https://www.civitatis.com/es/region-andina/,Honda,Tour privado de avistamiento de aves en Honda,"39.178,05 CL$",Sin valorar,Civitatis,2025-12-30 19:26
CLP,https://www.civitatis.com/es/region-andina/,Honda,Tour privado por Honda + Paseo en lancha por el río Magdalena,"117.534,15 CL$",Sin valorar,Civitatis,2025-12-30 19:26
CLP,https://www.civitatis.com/es/region-andina/,Barichara,Senderismo por el cañón del Chicamocha,"91.415,45 CL$",Sin valorar,Civitatis,2025-12-30 19:26
CLP,https://www.civitatis.com/es/region-andina/,Barichara,Taller de artesanía en Barichara,"27.424,63 CL$",Sin valorar,Civitatis,2025-12-30 19:26
CLP,https://www.civitatis.com/es/region-andina/,Barichara,Senderismo por el Camino Real hasta el cañón del Chicamocha + Teleférico Panachi,"172.383,42 CL$",Sin valorar,Civitatis,2025-12-30 19:26
CLP,https://www.civitatis.com/es/region-andina/,San Gil,Rafting en el río Chicamocha,"65.296,75 CL$",Sin valorar,Civitatis,2025-12-30 19:26
CLP,https://www.civitatis.com/es/region-andina/,Bucaramanga,Senderismo por el Páramo de Santurbán,"66.080,31 CL$",1 opinión,Civitatis,2025-12-30 19:26
CLP,https://www.civitatis.com/es/region-caribe/,Cartagena de Indias,Excursión a las islas del Rosario,"103.534,53 CL$",463 opiniones,Civitatis,2025-12-30 19:26
CLP,https://www.civitatis.com/es/region-caribe/,Cartagena de Indias,Free tour por Cartagena de Indias,¡Gratis!,3.693 opiniones,Civitatis,2025-12-30 19:26
CLP,https://www.civitatis.com/es/region-caribe/,Santa Marta,Excursión al Parque Tayrona,"57.461,14 CL$",330 opiniones,Civitatis,2025-12-30 19:26
CLP,https://www.civitatis.com/es/region-caribe/,Cartagena de Indias,Tour de Cartagena al completo con entradas,"38.094,12 CL$",378 opiniones,Civitatis,2025-12-30 19:26
CLP,https://www.civitatis.com/es/region-caribe/,Santa Marta,Excursión a Minca,"63.207,25 CL$",186 opiniones,Civitatis,2025-12-30 19:26
CLP,https://www.civitatis.com/es/region-caribe/,Cartagena de Indias,Free tour por el centro histórico y el barrio de Getsemaní,¡Gratis!,974 opiniones,Civitatis,2025-12-30 19:26
CLP,https://www.civitatis.com/es/region-caribe/,Cartagena de Indias,Excursión a Playa Blanca,"76.240,48 CL$",232 opiniones,Civitatis,2025-12-30 19:26
CLP,https://www.civitatis.com/es/region-caribe/,Cartagena de Indias,Excursión a las islas del Rosario para adultos,"67.554,04 CL$",21 opiniones,Civitatis,2025-12-30 19:26
CLP,https://www.civitatis.com/es/region-caribe/,Santa Marta,Free tour por Santa Marta,¡Gratis!,1.534 opiniones,Civitatis,2025-12-30 19:26
CLP,https://www.civitatis.com/es/region-caribe/,Cartagena de Indias,Tour en chiva rumbera por Cartagena + Fiesta en una discoteca,"14.365,28 CL$",184 opiniones,Civitatis,2025-12-30 19:26
CLP,https://www.civitatis.com/es/region-caribe/,Cartagena de Indias,Free tour por el Castillo de San Felipe de Barajas,¡Gratis!,123 opiniones,Civitatis,2025-12-30 19:26
CLP,https://www.civitatis.com/es/region-caribe/,Cartagena de Indias,Entrada a 51 Sky Bar,"15.671,22 CL$",12 opiniones,Civitatis,2025-12-30 19:26
CLP,https://www.civitatis.com/es/region-caribe/,Cartagena de Indias,Excursión a Islabela,"80.967,97 CL$",32 opiniones,Civitatis,2025-12-30 19:26
CLP,https://www.civitatis.com/es/region-caribe/,Cartagena de Indias,Free tour por el barrio de Getsemaní,¡Gratis!,1.252 opiniones,Civitatis,2025-12-30 19:26
CLP,https://www.civitatis.com/es/region-caribe/,Cartagena de Indias,Paseo en barco VIP al atardecer,"32.648,37 CL$",30 opiniones,Civitatis,2025-12-30 19:26
CLP,https://www.civitatis.com/es/region-caribe/,Santa Marta,Excursión a Playa Cristal,"56.155,20 CL$",136 opiniones,Civitatis,2025-12-30 19:26
CLP,https://www.civitatis.com/es/region-caribe/,Cartagena de Indias,Autobús turístico de Cartagena,"17.531,21 CL$",297 opiniones,Civitatis,2025-12-30 19:26
CLP,https://www.civitatis.com/es/region-caribe/,Santa Marta,Excursión a Playa Blanca y Mundo Marino,"75.744,23 CL$",35 opiniones,Civitatis,2025-12-30 19:26
CLP,https://www.civitatis.com/es/region-caribe/,Cartagena de Indias,Free tour de Gabriel García Márquez,¡Gratis!,255 opiniones,Civitatis,2025-12-30 19:26
