destino,pais,actividad,precio,moneda,rating,viajeros,operador,email,telefono,direccion,url_actividad,fecha_scan
Zagora,Marruecos,Tarjeta eSIM Civitatis Marruecos,"5.989,20 CL$",CLP,321 opiniones,7.704 viajeros,Airalo,Partnerships.Europe_CIS@airalo.com,,"AirGSM Pte. Ltd. | 6 Raffles Boulevard, Marina Square #03-308, Singapore 039594, Singapur, Singapur",https://www.civitatis.com/es/tarjeta-esim-marruecos/,2026-02-02
Ouarzazate,Marruecos,Excursión de 3 días al desierto de Merzouga,"163.962,82 CL$",CLP,5 opiniones,40 viajeros,Maroc Expedition,marocexpedition@gmail.com,+212 666161604,"Maroc Expedition Travel S.A.R.L | apar 13 rue ibn khaldoun Medina, Marrakech, Marruecos",https://www.civitatis.com/es/ouarzazate/excursion-tres-dias-desierto-merzouga/,2026-02-02
Ouarzazate,Marruecos,Excursión privada desde Ouarzazate,"163.962,82 CL$",CLP,2 opiniones,69 viajeros,Maroc Expedition,marocexpedition@gmail.com,+212 666161604,"Maroc Expedition Travel S.A.R.L | apar 13 rue ibn khaldoun Medina, Marrakech, Marruecos",https://www.civitatis.com/es/ouarzazate/excursion-privada-ouarzazate/,2026-02-02
Ouarzazate,Marruecos,Excursión privada de 2 días al desierto de Merzouga,"623.058,73 CL$",CLP,9 opiniones,114 viajeros,Maroc Expedition,marocexpedition@gmail.com,+212 666161604,"Maroc Expedition Travel S.A.R.L | apar 13 rue ibn khaldoun Medina, Marrakech, Marruecos",https://www.civitatis.com/es/ouarzazate/excursion-desierto-merzouga/,2026-02-02
Ouarzazate,Marruecos,Seguro de viaje Civitatis,"20.167,42 CL$",CLP,2.904 opiniones,95.919 viajeros,Iati,paz@iatiseguros.com,+34 932014943,"Iati Calzado Correduria de Seguros | C/ Guitard, 43, 4º 2ª, Barcelona, España",https://www.civitatis.com/es/seguro-viaje/,2026-02-02
Ouarzazate,Marruecos,Tarjeta eSIM Civitatis Marruecos,"5.989,20 CL$",CLP,321 opiniones,7.704 viajeros,Airalo,Partnerships.Europe_CIS@airalo.com,,"AirGSM Pte. Ltd. | 6 Raffles Boulevard, Marina Square #03-308, Singapore 039594, Singapur, Singapur",https://www.civitatis.com/es/tarjeta-esim-marruecos/,2026-02-02
Rabat,Marruecos,Tour privado por Rabat,"121.098,49 CL$",CLP,13 opiniones,269 viajeros,Morocco Visits,abdelhamidofficialguide@gmail.com,0613273112,"STE Morocco Global Visits SARL AU | RABATAGDAL, Rabat, Marruecos",https://www.civitatis.com/es/rabat/tour-privado-rabat/,2026-02-02
Rabat,Marruecos,Baño y masaje en el hammam Marassa,"30.606,39 CL$",CLP,4 opiniones,47 viajeros,Terra Tours,terraandtours@gmail.com,+34642353900,"TERRA TRADITIONS CONSULTING S.L. | Calle pensamiento numero 27  escalera izquierda planta 3 puerta 3, Madrid, España",https://www.civitatis.com/es/rabat/bano-masaje-hammam/,2026-02-02
Rabat,Marruecos,Visita guiada por Rabat,"21.861,71 CL$",CLP,23 opiniones,435 viajeros,Clearpath Mentors,clearpath.mentors@outlook.com,+212699184787,"Badr Eddine | Rue Jamaano 25, kasbah of udayas, Rabat, Marruecos",https://www.civitatis.com/es/rabat/visita-guiada-rabat/,2026-02-02
Rabat,Marruecos,Seguro de viaje Civitatis,"20.167,42 CL$",CLP,2.904 opiniones,95.919 viajeros,Iati,paz@iatiseguros.com,+34 932014943,"Iati Calzado Correduria de Seguros | C/ Guitard, 43, 4º 2ª, Barcelona, España",https://www.civitatis.com/es/seguro-viaje/,2026-02-02
Rabat,Marruecos,Tarjeta eSIM Civitatis Marruecos,"5.989,20 CL$",CLP,321 opiniones,7.704 viajeros,Airalo,Partnerships.Europe_CIS@airalo.com,,"AirGSM Pte. Ltd. | 6 Raffles Boulevard, Marina Square #03-308, Singapore 039594, Singapur, Singapur",https://www.civitatis.com/es/tarjeta-esim-marruecos/,2026-02-02
Rabat,Marruecos,Traslados en Rabat,"30.606,39 CL$",CLP,69 opiniones,761 viajeros,No especificado / Único,N/A,N/A,N/A,https://www.civitatis.com/es/rabat/traslados/,2026-02-02
Chefchaouen,Marruecos,Excursión privada a las cascadas de Akchour,"142.101,11 CL$",CLP,17 opiniones,200 viajeros,Chefchaouen Adventures,chefchaouen.adventures@gmail.com,+212 699 99 11 01,"Chefchaouen Adventures Travel Agency | Derb Lalla Zahra Qu Souk Chefchaouen , Chefchaouen, Marruecos",https://www.civitatis.com/es/chefchaouen/excursion-cascadas-akchour/,2026-02-02
Chefchaouen,Marruecos,Tour en quad por Akchour,"81.981,41 CL$",CLP,4 opiniones,25 viajeros,Guia Legal En Chefchaouen,yajilyan.actividades@gmail.com,+212682188489,"AJILYAN YOUSSEF | RUE DARDOUROU QUARTIER ONSAR CHEFCHAOUEN CHEFCHAOUEN, Chefchaouen, Marruecos",https://www.civitatis.com/es/chefchaouen/tour-quad-akchour/,2026-02-02
Chefchaouen,Marruecos,Baño y masaje en el hammam Riad Casa Miguel,"30.606,39 CL$",CLP,4 opiniones,14 viajeros,Terra Tours,terraandtours@gmail.com,+34642353900,"TERRA TRADITIONS CONSULTING S.L. | Calle pensamiento numero 27  escalera izquierda planta 3 puerta 3, Madrid, España",https://www.civitatis.com/es/chefchaouen/bano-masaje-hammam/,2026-02-02
Chefchaouen,Marruecos,Visita guiada por Chefchaouen,"16.396,28 CL$",CLP,131 opiniones,10.964 viajeros,Chefchaouen Adventures,chefchaouen.adventures@gmail.com,+212 699 99 11 01,"Chefchaouen Adventures Travel Agency | Derb Lalla Zahra Qu Souk Chefchaouen , Chefchaouen, Marruecos",https://www.civitatis.com/es/chefchaouen/visita-guiada-chefchaouen/,2026-02-02
Chefchaouen,Marruecos,Visita guiada por Chefchaouen,"16.396,28 CL$",CLP,131 opiniones,10.964 viajeros,Guia Legal En Chefchaouen,yajilyan.actividades@gmail.com,+212682188489,"AJILYAN YOUSSEF | RUE DARDOUROU QUARTIER ONSAR CHEFCHAOUEN CHEFCHAOUEN, Chefchaouen, Marruecos",https://www.civitatis.com/es/chefchaouen/visita-guiada-chefchaouen/,2026-02-02
Chefchaouen,Marruecos,Traslados en Chefchaouen,"172.707,50 CL$",CLP,2 opiniones,76 viajeros,No especificado / Único,N/A,N/A,N/A,https://www.civitatis.com/es/chefchaouen/traslados/,2026-02-02
Chefchaouen,Marruecos,Tour gastronómico por Chefchaouen,"66.492,39 CL$",CLP,2 opiniones,12 viajeros,Guia Legal En Chefchaouen,yajilyan.actividades@gmail.com,+212682188489,"AJILYAN YOUSSEF | RUE DARDOUROU QUARTIER ONSAR CHEFCHAOUEN CHEFCHAOUEN, Chefchaouen, Marruecos",https://www.civitatis.com/es/chefchaouen/tour-gastronomico-chefchaouen/,2026-02-02
Chefchaouen,Marruecos,Tour privado por Chefchaouen,"65.585,12 CL$",CLP,63 opiniones,726 viajeros,Chefchaouen Adventures,chefchaouen.adventures@gmail.com,+212 699 99 11 01,"Chefchaouen Adventures Travel Agency | Derb Lalla Zahra Qu Souk Chefchaouen , Chefchaouen, Marruecos",https://www.civitatis.com/es/chefchaouen/tour-privado-chefchaouen/,2026-02-02
Chefchaouen,Marruecos,Taller de marroquinería en Chefchaouen,"32.792,56 CL$",CLP,3 opiniones,19 viajeros,Guia Legal En Chefchaouen,yajilyan.actividades@gmail.com,+212682188489,"AJILYAN YOUSSEF | RUE DARDOUROU QUARTIER ONSAR CHEFCHAOUEN CHEFCHAOUEN, Chefchaouen, Marruecos",https://www.civitatis.com/es/chefchaouen/taller-marroquineria/,2026-02-02
Chefchaouen,Marruecos,Excursión privada al Puente de Dios de Akchour,"109.308,54 CL$",CLP,11 opiniones,85 viajeros,Chefchaouen Adventures,chefchaouen.adventures@gmail.com,+212 699 99 11 01,"Chefchaouen Adventures Travel Agency | Derb Lalla Zahra Qu Souk Chefchaouen , Chefchaouen, Marruecos",https://www.civitatis.com/es/chefchaouen/excursion-puente-dios/,2026-02-02
Chefchaouen,Marruecos,Ruta privada de 2 o 4 días de trekking de Chefchaouen a Akchour,"273.271,37 CL$",CLP,2 opiniones,23 viajeros,Chefchaouen Adventures,chefchaouen.adventures@gmail.com,+212 699 99 11 01,"Chefchaouen Adventures Travel Agency | Derb Lalla Zahra Qu Souk Chefchaouen , Chefchaouen, Marruecos",https://www.civitatis.com/es/chefchaouen/2-dias-trekking-chefchaouen-akchour/,2026-02-02
Chefchaouen,Marruecos,Excursión privada a la cueva de Knadel,"207.686,24 CL$",CLP,1 opinión,2 viajeros,Chefchaouen Adventures,chefchaouen.adventures@gmail.com,+212 699 99 11 01,"Chefchaouen Adventures Travel Agency | Derb Lalla Zahra Qu Souk Chefchaouen , Chefchaouen, Marruecos",https://www.civitatis.com/es/chefchaouen/excursion-cueva-knadel/,2026-02-02
Chefchaouen,Marruecos,Tarjeta eSIM Civitatis Marruecos,"5.989,20 CL$",CLP,321 opiniones,7.704 viajeros,Airalo,Partnerships.Europe_CIS@airalo.com,,"AirGSM Pte. Ltd. | 6 Raffles Boulevard, Marina Square #03-308, Singapore 039594, Singapur, Singapur",https://www.civitatis.com/es/tarjeta-esim-marruecos/,2026-02-02
Chefchaouen,Marruecos,Clase de cocina en Chefchaouen,"54.654,27 CL$",CLP,Novedad,,Chefchaouen Adventures,chefchaouen.adventures@gmail.com,+212 699 99 11 01,"Chefchaouen Adventures Travel Agency | Derb Lalla Zahra Qu Souk Chefchaouen , Chefchaouen, Marruecos",https://www.civitatis.com/es/chefchaouen/clase-cocina-chefchaouen/,2026-02-02
Chefchaouen,Marruecos,Seguro de viaje Civitatis,"20.167,42 CL$",CLP,2.904 opiniones,95.919 viajeros,Iati,paz@iatiseguros.com,+34 932014943,"Iati Calzado Correduria de Seguros | C/ Guitard, 43, 4º 2ª, Barcelona, España",https://www.civitatis.com/es/seguro-viaje/,2026-02-02
Tetuán,Marruecos,Excursión a Chefchaouen,"43.723,42 CL$",CLP,4 opiniones,69 viajeros,Chefchaouen Adventures,chefchaouen.adventures@gmail.com,+212 699 99 11 01,"Chefchaouen Adventures Travel Agency | Derb Lalla Zahra Qu Souk Chefchaouen , Chefchaouen, Marruecos",https://www.civitatis.com/es/tetuan/excursion-chefchaouen/,2026-02-02
Tetuán,Marruecos,Tour privado por Tetuán,"87.446,84 CL$",CLP,17 opiniones,659 viajeros,Chefchaouen Adventures,chefchaouen.adventures@gmail.com,+212 699 99 11 01,"Chefchaouen Adventures Travel Agency | Derb Lalla Zahra Qu Souk Chefchaouen , Chefchaouen, Marruecos",https://www.civitatis.com/es/tetuan/tour-privado-tetuan/,2026-02-02
Tetuán,Marruecos,Visita guiada por Tetuán,"16.396,28 CL$",CLP,10 opiniones,103 viajeros,Chefchaouen Adventures,chefchaouen.adventures@gmail.com,+212 699 99 11 01,"Chefchaouen Adventures Travel Agency | Derb Lalla Zahra Qu Souk Chefchaouen , Chefchaouen, Marruecos",https://www.civitatis.com/es/tetuan/visita-guiada-tetuan/,2026-02-02
Tetuán,Marruecos,Baño y masaje en el hammam Torgan,"30.606,39 CL$",CLP,2 opiniones,27 viajeros,Terra Tours,terraandtours@gmail.com,+34642353900,"TERRA TRADITIONS CONSULTING S.L. | Calle pensamiento numero 27  escalera izquierda planta 3 puerta 3, Madrid, España",https://www.civitatis.com/es/tetuan/bano-masaje-hammam/,2026-02-02
Tetuán,Marruecos,Seguro de viaje Civitatis,"20.167,42 CL$",CLP,2.904 opiniones,95.919 viajeros,Iati,paz@iatiseguros.com,+34 932014943,"Iati Calzado Correduria de Seguros | C/ Guitard, 43, 4º 2ª, Barcelona, España",https://www.civitatis.com/es/seguro-viaje/,2026-02-02
Tetuán,Marruecos,Tarjeta eSIM Civitatis Marruecos,"5.989,20 CL$",CLP,321 opiniones,7.704 viajeros,Airalo,Partnerships.Europe_CIS@airalo.com,,"AirGSM Pte. Ltd. | 6 Raffles Boulevard, Marina Square #03-308, Singapore 039594, Singapur, Singapur",https://www.civitatis.com/es/tarjeta-esim-marruecos/,2026-02-02
Esauira,Marruecos,Tour en quad por Esauira,"36.071,82 CL$",CLP,50 opiniones,960 viajeros,Diana Quad,dianaquad.essaouira@gmail.com,+212 600 022 077,"Diana Quad SARL | Ma, Esauira, Marruecos",https://www.civitatis.com/es/esauira/tour-quad-esauira/,2026-02-02
Esauira,Marruecos,Tour en quad por Esauira,"36.071,82 CL$",CLP,50 opiniones,960 viajeros,Sabiza Quad,assekour_123@hotmail.com,+212601731224,"STE SABIZA QUAD SARL AU | BOUTIQUE N 1 SISE AU RDC LOTS SIDI MAGDOUL 2 IMM EL BORJ, Esauira, Marruecos",https://www.civitatis.com/es/esauira/tour-quad-esauira/,2026-02-02
Esauira,Marruecos,Tour en quad + Paseo en camello,"57.933,53 CL$",CLP,9 opiniones,130 viajeros,Diana Quad,dianaquad.essaouira@gmail.com,+212 600 022 077,"Diana Quad SARL | Ma, Esauira, Marruecos",https://www.civitatis.com/es/esauira/tour-quad-paseo-camello/,2026-02-02
Esauira,Marruecos,Curso de surf en Esauira,"30.274,62 CL$",CLP,3 opiniones,25 viajeros,Essaouira Wavescape,info@essaouira-wavescape.com,+447901152444,"ESSAOUIRA WAVES CAPE | Rue du stade, Esauira, Marruecos",https://www.civitatis.com/es/esauira/curso-surf-esauira/,2026-02-02
Esauira,Marruecos,Tour por un mercado bereber + Visita a una cooperativa de argán,"38.257,99 CL$",CLP,4 opiniones,26 viajeros,Berberlands Ecotourism,berberlands@gmail.com,0034673849073,"Berberlands SARL | Magesin issu de la maison située au Douar Akrouj Commune, Sidi Ahmed Saih, Privince Essaouira, Esauira, Marruecos",https://www.civitatis.com/es/esauira/tour-mercado-bereber-cooperativa-argan/,2026-02-02
Esauira,Marruecos,Tour en moto eléctrica por Esauira,"41.879,89 CL$",CLP,1 opinión,13 viajeros,Lou's Rides,olivier@lousrides.com,+212606087567,"STE BELDI TROTT SARL AU | 4 rue Mohamed El Ayachi Essaouira, Esauira, Marruecos",https://www.civitatis.com/es/esauira/tour-moto-electrica-esauira/,2026-02-02
Esauira,Marruecos,Traslados en Esauira,"25.140,96 CL$",CLP,59 opiniones,810 viajeros,No especificado / Único,N/A,N/A,N/A,https://www.civitatis.com/es/esauira/traslados/,2026-02-02
Esauira,Marruecos,Tour por el mercado de Had Draa con degustación,"49.188,84 CL$",CLP,1 opinión,11 viajeros,Berberlands Ecotourism,berberlands@gmail.com,0034673849073,"Berberlands SARL | Magesin issu de la maison située au Douar Akrouj Commune, Sidi Ahmed Saih, Privince Essaouira, Esauira, Marruecos",https://www.civitatis.com/es/esauira/tour-mercado-had-draa-degustacion/,2026-02-02
Esauira,Marruecos,Clase de cocina marroquí en una aldea tradicional,"92.912,26 CL$",CLP,Sin valorar,,Berberlands Ecotourism,berberlands@gmail.com,0034673849073,"Berberlands SARL | Magesin issu de la maison située au Douar Akrouj Commune, Sidi Ahmed Saih, Privince Essaouira, Esauira, Marruecos",https://www.civitatis.com/es/esauira/clase-cocina-marroqui-aldea-tradicional/,2026-02-02
Esauira,Marruecos,Curso de kitesurf en Esauira,"55.503,47 CL$",CLP,Sin valorar,,Essaouira Wavescape,info@essaouira-wavescape.com,+447901152444,"ESSAOUIRA WAVES CAPE | Rue du stade, Esauira, Marruecos",https://www.civitatis.com/es/esauira/curso-kitesurf-esauira/,2026-02-02
Esauira,Marruecos,Paseo a caballo por Esauira,"27.327,13 CL$",CLP,1 opinión,33 viajeros,Go Booking Tours,sales@gobookingtours.com,212 635 22 50 18,"Get Your Travel | Avenida Al Wae 408, piso 2, Marrakech, Marruecos",https://www.civitatis.com/es/esauira/paseo-caballo-esauira/,2026-02-02
Esauira,Marruecos,Tour de comida callejera por Esauira,"54.654,27 CL$",CLP,1 opinión,21 viajeros,Go Booking Tours,sales@gobookingtours.com,212 635 22 50 18,"Get Your Travel | Avenida Al Wae 408, piso 2, Marrakech, Marruecos",https://www.civitatis.com/es/esauira/tour-comida-callejera-esauira/,2026-02-02
Esauira,Marruecos,Seguro de viaje Civitatis,"20.167,42 CL$",CLP,2.904 opiniones,95.919 viajeros,Iati,paz@iatiseguros.com,+34 932014943,"Iati Calzado Correduria de Seguros | C/ Guitard, 43, 4º 2ª, Barcelona, España",https://www.civitatis.com/es/seguro-viaje/,2026-02-02
Esauira,Marruecos,Tarjeta eSIM Civitatis Marruecos,"5.989,20 CL$",CLP,321 opiniones,7.704 viajeros,Airalo,Partnerships.Europe_CIS@airalo.com,,"AirGSM Pte. Ltd. | 6 Raffles Boulevard, Marina Square #03-308, Singapore 039594, Singapur, Singapur",https://www.civitatis.com/es/tarjeta-esim-marruecos/,2026-02-02
Taghazout,Marruecos,Excursión a las dunas de Timlaline + Quad o sandboarding,"34.513,07 CL$",CLP,9 opiniones,65 viajeros,Timlaline Guided Tour,info@timlalin.com,+212634883947,"MONSIEUR HASSAN AIT YOUSS | Agadir, tamri, timlaline, Agadir, Marruecos",https://www.civitatis.com/es/taghazout/excursion-timlaline-quad-sandboarding/,2026-02-02
Taghazout,Marruecos,Excursión de 2 días al desierto de El Borj,"189.103,79 CL$",CLP,Sin valorar,13 viajeros,Imohatours Ltd,contact@imohatours.com,+447846743360,"Imohatours Ltd | 2ND FL٥٥R COLLEGE HOUSE 17 KING EDWARDS ROAD, RUISLIP, Londres, Reino Unido",https://www.civitatis.com/es/taghazout/excursion-desierto-borj/,2026-02-02
Taghazout,Marruecos,Paseo a caballo por la costa de Agadir,"32.792,56 CL$",CLP,Sin valorar,41 viajeros,Amodoucheval,amodoucheval@gmail.com,+212670341510,"Adil Ait El Mahjoub | Km 13 Route N1 Tamraght, Aourir, Agadir, Marruecos",https://www.civitatis.com/es/taghazout/paseo-caballo-costa-agadir/,2026-02-02
Taghazout,Marruecos,Cena y espectáculo de fantasía en Chems Ayour,"60.549,24 CL$",CLP,Sin valorar,237 viajeros,Chems Ayour,infos.chemsayour@gmail.com,+212 610 33 33 37,"Chems Ayour | BP266 N10, Ain sidi Belkacem, Temsia Inezgane-Ait Melloul, Agadir, Agadir, Marruecos",https://www.civitatis.com/es/taghazout/cena-espectaculo-bereber/,2026-02-02
Taghazout,Marruecos,Excursión a Legzira,"109.308,54 CL$",CLP,4 opiniones,88 viajeros,Ecolodge-Adventures,reservations@ecolodge-adventures.com,+212 0 660-047-248,"STE Ecolodge Adventures | Hay Pam Bloc 2 number 31 ait iaaza , Taroudant, Marruecos",https://www.civitatis.com/es/taghazout/excursion-legzira/,2026-02-02
Taghazout,Marruecos,Excursión a Tarudant,"97.284,60 CL$",CLP,7 opiniones,92 viajeros,Ecolodge-Adventures,reservations@ecolodge-adventures.com,+212 0 660-047-248,"STE Ecolodge Adventures | Hay Pam Bloc 2 number 31 ait iaaza , Taroudant, Marruecos",https://www.civitatis.com/es/taghazout/excursion-tarudant/,2026-02-02
Taghazout,Marruecos,Excursión a Paradise Valley,"24.047,88 CL$",CLP,Sin valorar,20 viajeros,Imohatours Ltd,contact@imohatours.com,+447846743360,"Imohatours Ltd | 2ND FL٥٥R COLLEGE HOUSE 17 KING EDWARDS ROAD, RUISLIP, Londres, Reino Unido",https://www.civitatis.com/es/taghazout/excursion-paradise-valley/,2026-02-02
Taghazout,Marruecos,Tour en quad por Taghazout,"43.723,42 CL$",CLP,Sin valorar,9 viajeros,Imohatours Ltd,contact@imohatours.com,+447846743360,"Imohatours Ltd | 2ND FL٥٥R COLLEGE HOUSE 17 KING EDWARDS ROAD, RUISLIP, Londres, Reino Unido",https://www.civitatis.com/es/taghazout/tour-quad-taghazout/,2026-02-02
Taghazout,Marruecos,Sandboarding en el desierto de Taboga,"32.792,56 CL$",CLP,2 opiniones,14 viajeros,Amodoucheval,amodoucheval@gmail.com,+212670341510,"Adil Ait El Mahjoub | Km 13 Route N1 Tamraght, Aourir, Agadir, Marruecos",https://www.civitatis.com/es/taghazout/sandboarding-desierto-taboga/,2026-02-02
Taghazout,Marruecos,Paseo en globo por Agadir,"229.547,95 CL$",CLP,Sin valorar,16 viajeros,Adventure Balloon Marrakech,info@adventure-balloon.com,+212691707744,"Adventure Balloon LLC | HAYATE CHADILI SOLE MBR, Marrakech, Marruecos",https://www.civitatis.com/es/taghazout/paseo-globo-agadir/,2026-02-02
Taghazout,Marruecos,Paseo en globo por Agadir,"229.547,95 CL$",CLP,Sin valorar,16 viajeros,Go Booking Tours,sales@gobookingtours.com,212 635 22 50 18,"Get Your Travel | Avenida Al Wae 408, piso 2, Marrakech, Marruecos",https://www.civitatis.com/es/taghazout/paseo-globo-agadir/,2026-02-02
Taghazout,Marruecos,Tarjeta eSIM Civitatis Marruecos,"5.989,20 CL$",CLP,321 opiniones,7.704 viajeros,Airalo,Partnerships.Europe_CIS@airalo.com,,"AirGSM Pte. Ltd. | 6 Raffles Boulevard, Marina Square #03-308, Singapore 039594, Singapur, Singapur",https://www.civitatis.com/es/tarjeta-esim-marruecos/,2026-02-02
Taghazout,Marruecos,Excursión a Marrakech,"49.188,84 CL$",CLP,Sin valorar,6 viajeros,Imohatours Ltd,contact@imohatours.com,+447846743360,"Imohatours Ltd | 2ND FL٥٥R COLLEGE HOUSE 17 KING EDWARDS ROAD, RUISLIP, Londres, Reino Unido",https://www.civitatis.com/es/taghazout/excursion-marrakech/,2026-02-02
Taghazout,Marruecos,Excursión a Tiznit + Desert Safari,"61.212,78 CL$",CLP,2 opiniones,16 viajeros,Agadir Journey,agadirjourney10@gmail.com,002120677753324,"Agadir Journey | Complexe kasbat souss km 5 Reut principal inzgan Bensargao, Agadir, Marruecos",https://www.civitatis.com/es/taghazout/excursion-tiznit-desert-safari/,2026-02-02
Taghazout,Marruecos,Curso de surf en Taghazout,"43.723,42 CL$",CLP,Sin valorar,3 viajeros,Original Surf Sarl,originalsurfmorocco@gmail.com,0707737798,"Original Surf | Tamraght village,  Agadir, Agadir, Marruecos",https://www.civitatis.com/es/taghazout/curso-surf-taghazout/,2026-02-02
Taghazout,Marruecos,Excursión a Agadir,"26.234,05 CL$",CLP,Sin valorar,,Imohatours Ltd,contact@imohatours.com,+447846743360,"Imohatours Ltd | 2ND FL٥٥R COLLEGE HOUSE 17 KING EDWARDS ROAD, RUISLIP, Londres, Reino Unido",https://www.civitatis.com/es/taghazout/excursion-agadir/,2026-02-02
Taghazout,Marruecos,Excursión al Parque Nacional de Souss-Massa,"76.515,98 CL$",CLP,1 opinión,2 viajeros,Imohatours Ltd,contact@imohatours.com,+447846743360,"Imohatours Ltd | 2ND FL٥٥R COLLEGE HOUSE 17 KING EDWARDS ROAD, RUISLIP, Londres, Reino Unido",https://www.civitatis.com/es/taghazout/excursion-parque-nacional-souss-massa/,2026-02-02
Taghazout,Marruecos,Seguro de viaje Civitatis,"20.167,42 CL$",CLP,2.904 opiniones,95.919 viajeros,Iati,paz@iatiseguros.com,+34 932014943,"Iati Calzado Correduria de Seguros | C/ Guitard, 43, 4º 2ª, Barcelona, España",https://www.civitatis.com/es/seguro-viaje/,2026-02-02
Taghazout,Marruecos,Experiencia en el hammam Agadir Spa,"27.327,13 CL$",CLP,Sin valorar,2 viajeros,Imohatours Ltd,contact@imohatours.com,+447846743360,"Imohatours Ltd | 2ND FL٥٥R COLLEGE HOUSE 17 KING EDWARDS ROAD, RUISLIP, Londres, Reino Unido",https://www.civitatis.com/es/taghazout/hammam-agadir-spa/,2026-02-02
Taghazout,Marruecos,Excursión al Valle de Tizgui,"49.188,84 CL$",CLP,Sin valorar,2 viajeros,Imohatours Ltd,contact@imohatours.com,+447846743360,"Imohatours Ltd | 2ND FL٥٥R COLLEGE HOUSE 17 KING EDWARDS ROAD, RUISLIP, Londres, Reino Unido",https://www.civitatis.com/es/taghazout/excursion-valle-tizgui/,2026-02-02
Taghazout,Marruecos,Teleférico de Agadir,"40.444,16 CL$",CLP,Sin valorar,26 viajeros,Agadir Journey,agadirjourney10@gmail.com,002120677753324,"Agadir Journey | Complexe kasbat souss km 5 Reut principal inzgan Bensargao, Agadir, Marruecos",https://www.civitatis.com/es/taghazout/teleferico-agadir/,2026-02-02
Taghazout,Marruecos,Excursión a Esauira,"41.537,24 CL$",CLP,Sin valorar,23 viajeros,Imohatours Ltd,contact@imohatours.com,+447846743360,"Imohatours Ltd | 2ND FL٥٥R COLLEGE HOUSE 17 KING EDWARDS ROAD, RUISLIP, Londres, Reino Unido",https://www.civitatis.com/es/taghazout/excursion-esauira/,2026-02-02
Dajla,Marruecos,Tour privado en 4x4 por el desierto de Imlili,"240.478,80 CL$",CLP,Sin valorar,4 viajeros,Imohatours Ltd,contact@imohatours.com,+447846743360,"Imohatours Ltd | 2ND FL٥٥R COLLEGE HOUSE 17 KING EDWARDS ROAD, RUISLIP, Londres, Reino Unido",https://www.civitatis.com/es/dajla/tour-privado-4x4-desierto-imlili/,2026-02-02
Dajla,Marruecos,Tour privado en 4x4 por la Duna Blanca de Dajla,"136.635,68 CL$",CLP,6 opiniones,50 viajeros,Go Booking Tours,sales@gobookingtours.com,212 635 22 50 18,"Get Your Travel | Avenida Al Wae 408, piso 2, Marrakech, Marruecos",https://www.civitatis.com/es/dajla/tour-4x4-duna-blanca-dajla/,2026-02-02
Dajla,Marruecos,Paseo en camello por Dajla,"56.840,44 CL$",CLP,Sin valorar,9 viajeros,Go Booking Tours,sales@gobookingtours.com,212 635 22 50 18,"Get Your Travel | Avenida Al Wae 408, piso 2, Marrakech, Marruecos",https://www.civitatis.com/es/dajla/paseo-camello-dajla/,2026-02-02
Dajla,Marruecos,Curso de kitesurf en Dajla,"97.284,60 CL$",CLP,Sin valorar,1 viajero,Go Booking Tours,sales@gobookingtours.com,212 635 22 50 18,"Get Your Travel | Avenida Al Wae 408, piso 2, Marrakech, Marruecos",https://www.civitatis.com/es/dajla/curso-kitesurf-dajla/,2026-02-02
Dajla,Marruecos,Tour privado por Dajla,"240.478,80 CL$",CLP,Sin valorar,,Imohatours Ltd,contact@imohatours.com,+447846743360,"Imohatours Ltd | 2ND FL٥٥R COLLEGE HOUSE 17 KING EDWARDS ROAD, RUISLIP, Londres, Reino Unido",https://www.civitatis.com/es/dajla/tour-privado-dajla/,2026-02-02
Dajla,Marruecos,Bautismo de buceo en Dajla,"95.098,43 CL$",CLP,Sin valorar,2 viajeros,Go Booking Tours,sales@gobookingtours.com,212 635 22 50 18,"Get Your Travel | Avenida Al Wae 408, piso 2, Marrakech, Marruecos",https://www.civitatis.com/es/dajla/bautismo-buceo-dajla/,2026-02-02
Dajla,Marruecos,Paseo en catamarán por Dajla,"108.215,46 CL$",CLP,1 opinión,27 viajeros,Go Booking Tours,sales@gobookingtours.com,212 635 22 50 18,"Get Your Travel | Avenida Al Wae 408, piso 2, Marrakech, Marruecos",https://www.civitatis.com/es/dajla/paseo-catamaran-dajla/,2026-02-02
Dajla,Marruecos,Curso de surf en Dajla,"60.119,70 CL$",CLP,Sin valorar,3 viajeros,Go Booking Tours,sales@gobookingtours.com,212 635 22 50 18,"Get Your Travel | Avenida Al Wae 408, piso 2, Marrakech, Marruecos",https://www.civitatis.com/es/dajla/curso-surf-dajla/,2026-02-02
Dajla,Marruecos,Seguro de viaje Civitatis,"20.167,42 CL$",CLP,2.904 opiniones,95.919 viajeros,Iati,paz@iatiseguros.com,+34 932014943,"Iati Calzado Correduria de Seguros | C/ Guitard, 43, 4º 2ª, Barcelona, España",https://www.civitatis.com/es/seguro-viaje/,2026-02-02
Dajla,Marruecos,Tarjeta eSIM Civitatis Marruecos,"5.989,20 CL$",CLP,321 opiniones,7.704 viajeros,Airalo,Partnerships.Europe_CIS@airalo.com,,"AirGSM Pte. Ltd. | 6 Raffles Boulevard, Marina Square #03-308, Singapore 039594, Singapur, Singapur",https://www.civitatis.com/es/tarjeta-esim-marruecos/,2026-02-02
Erfoud,Marruecos,Amanecer o atardecer en el desierto de Merzouga,"60.119,70 CL$",CLP,Sin valorar,5 viajeros,Maroc Expedition,marocexpedition@gmail.com,+212 666161604,"Maroc Expedition Travel S.A.R.L | apar 13 rue ibn khaldoun Medina, Marrakech, Marruecos",https://www.civitatis.com/es/erfoud/amanecer-atardecer-desierto-merzouga/,2026-02-02
Erfoud,Marruecos,Seguro de viaje Civitatis,"20.167,42 CL$",CLP,2.904 opiniones,95.919 viajeros,Iati,paz@iatiseguros.com,+34 932014943,"Iati Calzado Correduria de Seguros | C/ Guitard, 43, 4º 2ª, Barcelona, España",https://www.civitatis.com/es/seguro-viaje/,2026-02-02
Erfoud,Marruecos,Tarjeta eSIM Civitatis Marruecos,"5.989,20 CL$",CLP,321 opiniones,7.704 viajeros,Airalo,Partnerships.Europe_CIS@airalo.com,,"AirGSM Pte. Ltd. | 6 Raffles Boulevard, Marina Square #03-308, Singapore 039594, Singapur, Singapur",https://www.civitatis.com/es/tarjeta-esim-marruecos/,2026-02-02
Timlalin,Marruecos,Excursión a Paradise Valley,"24.047,88 CL$",CLP,Sin valorar,20 viajeros,Imohatours Ltd,contact@imohatours.com,+447846743360,"Imohatours Ltd | 2ND FL٥٥R COLLEGE HOUSE 17 KING EDWARDS ROAD, RUISLIP, Londres, Reino Unido",https://www.civitatis.com/es/taghazout/excursion-paradise-valley/,2026-02-02
