destino,pais,actividad,precio,moneda,rating,viajeros,operador,email,telefono,direccion,url_actividad,fecha_scan
Mónaco,Mónaco,Visita guiada por Mónaco,"42.630,33 CL$",CLP,15 opiniones,250 viajeros,Riviera Bar Crawl & Tours,info@rivierabarcrawl.com,+33 649 244 407,"SAS LUXSTARS INVESTMENT | 18 rue Masséna, Bureau 3, Niza, Francia",https://www.civitatis.com/es/monaco/visita-guiada-monaco/,2026-02-02
Mónaco,Mónaco,Entrada al Museo Oceanográfico,"24.594,42 CL$",CLP,34 opiniones,1.134 viajeros,Musée Océanographique De Monaco,s.commercial@oceano.org,+37793153671,"MUSEE OCEANOGRAPHIQUE DE MONACO | Avenue Saint Martin, Mónaco, Mónaco",https://www.civitatis.com/es/monaco/entrada-museo-oceanografico/,2026-02-02
Mónaco,Mónaco,Visita guiada por el circuito de Fórmula 1,"48.095,76 CL$",CLP,20 opiniones,303 viajeros,The Inside Track Monaco,theMonacoinsidetrack@gmail.com,+33785997847,"M. TOMMASO BATTAGLIA | 5, Allee Crovetto Freres, Mónaco, Mónaco",https://www.civitatis.com/es/monaco/visita-guiada-circuito-formula-1/,2026-02-02
Mónaco,Mónaco,Tour privado por Mónaco,"426.303,34 CL$",CLP,2 opiniones,111 viajeros,Riviera Bar Crawl & Tours,info@rivierabarcrawl.com,+33 649 244 407,"SAS LUXSTARS INVESTMENT | 18 rue Masséna, Bureau 3, Niza, Francia",https://www.civitatis.com/es/monaco/tour-privado-monaco/,2026-02-02
Mónaco,Mónaco,Seguro de viaje Civitatis,"20.167,42 CL$",CLP,2.904 opiniones,95.919 viajeros,Iati,paz@iatiseguros.com,+34 932014943,"Iati Calzado Correduria de Seguros | C/ Guitard, 43, 4º 2ª, Barcelona, España",https://www.civitatis.com/es/seguro-viaje/,2026-02-02
